No.,Time,Source,Destination,Protocol,Length,Info
1,0,10.4.246.118,10.4.255.255,BROWSER,220,Request Announcement TAMSDEN
2,0.0002,10.4.246.118,93.184.220.29,OCSP,359,Request
3,0.032606,93.184.220.29,10.4.246.118,TCP,54,80  >  1677 [ACK] Seq=1 Ack=306 Win=52 Len=0
4,0.032818,93.184.220.29,10.4.246.118,TCP,54,"80  >  1677 [FIN, ACK] Seq=1 Ack=306 Win=52 Len=0"
5,0.032875,10.4.246.118,93.184.220.29,TCP,54,1677  >  80 [ACK] Seq=306 Ack=2 Win=512 Len=0
6,0.033177,10.4.246.118,93.184.220.29,TCP,54,"1677  >  80 [FIN, ACK] Seq=306 Ack=2 Win=512 Len=0"
7,0.055673,10.4.246.118,10.65.2.46,DNS,74,Standard query 0xdf84 A cdp.thawte.com
8,0.060437,93.184.220.29,10.4.246.118,TCP,54,80  >  1677 [ACK] Seq=2 Ack=307 Win=52 Len=0
9,0.077877,10.4.246.118,10.65.2.46,DNS,74,Standard query 0xdf84 A cdp.thawte.com
10,0.085729,10.65.2.46,10.4.246.118,DNS,150,Standard query response 0xdf84 A cdp.thawte.com CNAME crl3.digicert.com CNAME cs9.wac.phicdn.net A 93.184.220.29
11,0.089028,10.4.246.118,93.184.220.29,TCP,66,1680  >  80 [SYN] Seq=0 Win=64240 Len=0 MSS=1460 WS=256 SACK_PERM=1
12,0.106961,10.65.2.46,10.4.246.118,DNS,150,Standard query response 0xdf84 A cdp.thawte.com CNAME crl3.digicert.com CNAME cs9.wac.phicdn.net A 93.184.220.29
13,0.117102,93.184.220.29,10.4.246.118,TCP,66,"80  >  1680 [SYN, ACK] Seq=0 Ack=1 Win=5560 Len=0 MSS=1250 SACK_PERM=1 WS=128"
14,0.117289,10.4.246.118,93.184.220.29,TCP,54,1680  >  80 [ACK] Seq=1 Ack=1 Win=131072 Len=0
15,0.118369,10.4.246.118,93.184.220.29,HTTP,190,GET /ThawteEVRSACA2018.crl HTTP/1.1 
16,0.119159,10.4.246.118,52.16.176.29,TCP,66,1681  >  443 [SYN] Seq=0 Win=65535 Len=0 MSS=1460 WS=8 SACK_PERM=1
17,0.146185,93.184.220.29,10.4.246.118,TCP,54,80  >  1680 [ACK] Seq=1 Ack=137 Win=6656 Len=0
18,0.146465,93.184.220.29,10.4.246.118,HTTP,814,HTTP/1.1 200 OK  (text/html)
19,0.146644,93.184.220.29,10.4.246.118,TCP,54,"80  >  1680 [FIN, ACK] Seq=761 Ack=137 Win=6656 Len=0"
20,0.146691,10.4.246.118,93.184.220.29,TCP,54,1680  >  80 [ACK] Seq=137 Ack=762 Win=130304 Len=0
21,0.146876,52.16.176.29,10.4.246.118,TCP,66,"443  >  1681 [SYN, ACK] Seq=0 Ack=1 Win=5560 Len=0 MSS=1250 SACK_PERM=1 WS=128"
22,0.147004,10.4.246.118,52.16.176.29,TCP,54,1681  >  443 [ACK] Seq=1 Ack=1 Win=262176 Len=0
23,0.148189,10.4.246.118,52.16.176.29,TLSv1,571,Client Hello
24,0.176108,52.16.176.29,10.4.246.118,TCP,54,443  >  1681 [ACK] Seq=1 Ack=518 Win=6656 Len=0
25,0.176363,52.16.176.29,10.4.246.118,TCP,54,"443  >  1681 [FIN, ACK] Seq=1 Ack=518 Win=6656 Len=0"
26,0.176443,10.4.246.118,52.16.176.29,TCP,54,1681  >  443 [ACK] Seq=518 Ack=2 Win=262176 Len=0
27,0.176775,10.4.246.118,52.16.176.29,TCP,54,"1681  >  443 [FIN, ACK] Seq=518 Ack=2 Win=262176 Len=0"
28,0.204249,52.16.176.29,10.4.246.118,TCP,54,443  >  1681 [ACK] Seq=2 Ack=519 Win=6656 Len=0
29,0.571737,Cisco_23:ed:60,Broadcast,ARP,42,Gratuitous ARP for 10.106.32.1 (Reply)
30,0.884902,Cisco_23:ed:60,Broadcast,ARP,42,Gratuitous ARP for 10.106.64.1 (Reply)
31,1.469005,10.4.246.118,224.0.0.251,MDNS,311,"Standard query response 0x0000 PTR, cache flush Tamsden.local PTR, cache flush Tamsden.local A, cache flush 10.4.246.118 AAAA, cache flush fe80::74b6:23b5:8575:9d8 NSEC, cache flush 118.246.4.10.in-addr.arpa NSEC, cache flush 8.D.9.0.5.7.5.8.5.B.3.2.6.B.4.7.0.0.0.0.0.0.0.0.0.0.0.0.0.8.E.F.ip6.arpa NSEC, cache flush Tamsden.local OPT"
32,1.499942,10.4.246.118,10.4.255.255,BROWSER,220,Request Announcement TAMSDEN
33,1.696922,10.4.246.118,10.65.2.46,DNS,90,Standard query 0xfcbb A self.events.data.microsoft.com
34,1.718965,10.4.246.118,10.65.2.46,DNS,90,Standard query 0xfcbb A self.events.data.microsoft.com
35,1.731278,10.65.2.46,10.4.246.118,DNS,160,Standard query response 0xfcbb A self.events.data.microsoft.com CNAME self.events.data.onecollector.akadns.net A 52.114.32.8
36,1.747171,10.65.2.46,10.4.246.118,DNS,160,Standard query response 0xfcbb A self.events.data.microsoft.com CNAME self.events.data.onecollector.akadns.net A 52.114.32.8
37,1.777516,10.4.246.118,52.114.32.8,TCP,66,1682  >  443 [SYN] Seq=0 Win=65535 Len=0 MSS=1460 WS=256 SACK_PERM=1
38,1.80502,52.114.32.8,10.4.246.118,TCP,66,"443  >  1682 [SYN, ACK] Seq=0 Ack=1 Win=5560 Len=0 MSS=1250 SACK_PERM=1 WS=128"
39,1.805195,10.4.246.118,52.114.32.8,TCP,54,1682  >  443 [ACK] Seq=1 Ack=1 Win=262144 Len=0
40,1.808265,10.4.246.118,52.114.32.8,TLSv1.2,245,Client Hello
41,1.813502,10.4.246.118,93.184.220.29,TCP,54,"1680  >  80 [FIN, ACK] Seq=137 Ack=762 Win=130304 Len=0"
42,1.835869,52.114.32.8,10.4.246.118,TCP,54,443  >  1682 [ACK] Seq=1 Ack=192 Win=6656 Len=0
43,1.83607,52.114.32.8,10.4.246.118,TCP,54,"443  >  1682 [FIN, ACK] Seq=1 Ack=192 Win=6656 Len=0"
44,1.836124,10.4.246.118,52.114.32.8,TCP,54,1682  >  443 [ACK] Seq=192 Ack=2 Win=262144 Len=0
45,1.841083,93.184.220.29,10.4.246.118,TCP,54,80  >  1680 [ACK] Seq=762 Ack=138 Win=6656 Len=0
46,1.842823,10.4.246.118,52.114.32.8,TCP,54,"1682  >  443 [FIN, ACK] Seq=192 Ack=2 Win=262144 Len=0"
47,1.851643,10.4.246.118,10.65.0.31,TCP,54,"1656  >  443 [FIN, ACK] Seq=1 Ack=1 Win=65535 Len=0"
48,1.856242,10.4.246.118,52.114.32.8,TCP,66,1683  >  443 [SYN] Seq=0 Win=65535 Len=0 MSS=1460 WS=256 SACK_PERM=1
49,1.868675,10.4.246.118,10.65.0.31,TCP,66,1684  >  443 [SYN] Seq=0 Win=65535 Len=0 MSS=1460 WS=256 SACK_PERM=1
50,1.87021,52.114.32.8,10.4.246.118,TCP,54,443  >  1682 [ACK] Seq=2 Ack=193 Win=6656 Len=0
51,1.880155,10.65.0.31,10.4.246.118,TCP,54,443  >  1656 [ACK] Seq=1 Ack=2 Win=3959 Len=0
52,1.880673,10.65.0.31,10.4.246.118,TCP,54,"443  >  1656 [FIN, ACK] Seq=1 Ack=2 Win=3959 Len=0"
53,1.880747,10.4.246.118,10.65.0.31,TCP,54,1656  >  443 [ACK] Seq=2 Ack=2 Win=65535 Len=0
54,1.883776,52.114.32.8,10.4.246.118,TCP,66,"443  >  1683 [SYN, ACK] Seq=0 Ack=1 Win=5560 Len=0 MSS=1250 SACK_PERM=1 WS=128"
55,1.883893,10.4.246.118,52.114.32.8,TCP,54,1683  >  443 [ACK] Seq=1 Ack=1 Win=262144 Len=0
56,1.88429,10.4.246.118,52.114.32.8,TLSv1,197,Client Hello
57,1.900899,10.65.0.31,10.4.246.118,TCP,62,"443  >  1684 [SYN, ACK] Seq=0 Ack=1 Win=3750 Len=0 MSS=1250 SACK_PERM=1"
58,1.901015,10.4.246.118,10.65.0.31,TCP,54,1684  >  443 [ACK] Seq=1 Ack=1 Win=65535 Len=0
59,1.901843,10.4.246.118,10.65.0.31,TLSv1.2,263,Client Hello
60,1.912032,52.114.32.8,10.4.246.118,TCP,54,443  >  1683 [ACK] Seq=1 Ack=144 Win=6656 Len=0
61,1.912327,52.114.32.8,10.4.246.118,TCP,54,"443  >  1683 [FIN, ACK] Seq=1 Ack=144 Win=6656 Len=0"
62,1.912371,10.4.246.118,52.114.32.8,TCP,54,1683  >  443 [ACK] Seq=144 Ack=2 Win=262144 Len=0
63,1.912634,10.4.246.118,52.114.32.8,TCP,54,"1683  >  443 [FIN, ACK] Seq=144 Ack=2 Win=262144 Len=0"
64,1.913753,10.4.246.118,52.114.32.8,TCP,66,1685  >  443 [SYN] Seq=0 Win=65535 Len=0 MSS=1460 WS=256 SACK_PERM=1
65,1.933424,10.65.0.31,10.4.246.118,TCP,54,443  >  1684 [ACK] Seq=1 Ack=210 Win=3959 Len=0
66,1.93799,10.65.0.31,10.4.246.118,TLSv1.2,1304,Server Hello
67,1.938058,10.4.246.118,10.65.0.31,TCP,54,1684  >  443 [ACK] Seq=210 Ack=1251 Win=65535 Len=0
68,1.938244,10.65.0.31,10.4.246.118,TCP,1304,443  >  1684 [ACK] Seq=1251 Ack=210 Win=3959 Len=1250 [TCP segment of a reassembled PDU]
69,1.938272,10.4.246.118,10.65.0.31,TCP,54,1684  >  443 [ACK] Seq=210 Ack=2501 Win=65535 Len=0
70,1.938855,10.65.0.31,10.4.246.118,TLSv1.2,929,"Certificate, Server Key Exchange, Server Hello Done"
71,1.938894,10.4.246.118,10.65.0.31,TCP,54,1684  >  443 [ACK] Seq=210 Ack=3376 Win=65535 Len=0
72,1.940033,52.114.32.8,10.4.246.118,TCP,54,443  >  1683 [ACK] Seq=2 Ack=145 Win=6656 Len=0
73,1.940949,52.114.32.8,10.4.246.118,TCP,66,"443  >  1685 [SYN, ACK] Seq=0 Ack=1 Win=5560 Len=0 MSS=1250 SACK_PERM=1 WS=128"
74,1.941049,10.4.246.118,52.114.32.8,TCP,54,1685  >  443 [ACK] Seq=1 Ack=1 Win=262144 Len=0
75,1.941279,10.4.246.118,52.114.32.8,TCP,54,"1685  >  443 [FIN, ACK] Seq=1 Ack=1 Win=262144 Len=0"
76,1.944158,10.4.246.118,10.65.0.31,TLSv1.2,180,"Client Key Exchange, Change Cipher Spec, Encrypted Handshake Message"
77,1.969103,52.114.32.8,10.4.246.118,TCP,54,"443  >  1685 [FIN, ACK] Seq=1 Ack=2 Win=5632 Len=0"
78,1.969178,10.4.246.118,52.114.32.8,TCP,54,1685  >  443 [ACK] Seq=2 Ack=2 Win=262144 Len=0
79,1.972558,10.65.0.31,10.4.246.118,TCP,54,443  >  1684 [ACK] Seq=3376 Ack=336 Win=4085 Len=0
80,1.973542,10.65.0.31,10.4.246.118,TLSv1.2,328,"New Session Ticket, Change Cipher Spec, Encrypted Handshake Message"
81,1.973599,10.4.246.118,10.65.0.31,TCP,54,1684  >  443 [ACK] Seq=336 Ack=3650 Win=65535 Len=0
82,2.018373,10.4.246.118,10.65.0.31,TLSv1.2,650,Application Data
83,2.033738,Cisco_23:ed:60,Broadcast,ARP,42,Gratuitous ARP for 10.106.176.1 (Reply)
84,2.047731,10.65.0.31,10.4.246.118,TCP,54,443  >  1684 [ACK] Seq=3650 Ack=932 Win=4681 Len=0
85,2.064352,10.65.0.31,10.4.246.118,TLSv1.2,1304,Application Data
86,2.064441,10.4.246.118,10.65.0.31,TCP,54,1684  >  443 [ACK] Seq=932 Ack=4900 Win=65535 Len=0
87,2.064814,10.65.0.31,10.4.246.118,TCP,1304,"443  >  1684 [PSH, ACK] Seq=4900 Ack=932 Win=4681 Len=1250 [TCP segment of a reassembled PDU]"
88,2.064874,10.4.246.118,10.65.0.31,TCP,54,1684  >  443 [ACK] Seq=932 Ack=6150 Win=65535 Len=0
89,2.065277,10.65.0.31,10.4.246.118,TLSv1.2,1056,Application Data
90,2.065279,10.65.0.31,10.4.246.118,TLSv1.2,85,Encrypted Alert
91,2.06528,10.65.0.31,10.4.246.118,TCP,54,"443  >  1684 [FIN, ACK] Seq=7183 Ack=932 Win=4681 Len=0"
92,2.065374,10.4.246.118,10.65.0.31,TCP,54,1684  >  443 [ACK] Seq=932 Ack=7184 Win=65535 Len=0
93,2.068937,10.4.246.118,10.65.0.31,TCP,54,"1684  >  443 [FIN, ACK] Seq=932 Ack=7184 Win=65535 Len=0"
94,2.069062,10.4.246.118,10.65.0.31,TCP,54,"1684  >  443 [RST, ACK] Seq=933 Ack=7184 Win=0 Len=0"
95,2.096767,10.65.0.31,10.4.246.118,TCP,54,443  >  1684 [ACK] Seq=7184 Ack=933 Win=4681 Len=0
96,2.134082,10.4.246.118,10.65.0.31,TCP,66,1686  >  443 [SYN] Seq=0 Win=65535 Len=0 MSS=1460 WS=256 SACK_PERM=1
97,2.137985,10.4.246.118,10.65.0.31,TCP,66,1687  >  443 [SYN] Seq=0 Win=65535 Len=0 MSS=1460 WS=256 SACK_PERM=1
98,2.164937,10.65.0.31,10.4.246.118,TCP,62,"443  >  1686 [SYN, ACK] Seq=0 Ack=1 Win=3750 Len=0 MSS=1250 SACK_PERM=1"
99,2.165016,10.4.246.118,10.65.0.31,TCP,54,1686  >  443 [ACK] Seq=1 Ack=1 Win=65535 Len=0
100,2.165471,10.4.246.118,10.65.0.31,TLSv1.2,263,Client Hello
101,2.172944,10.65.0.31,10.4.246.118,TCP,62,"443  >  1687 [SYN, ACK] Seq=0 Ack=1 Win=3750 Len=0 MSS=1250 SACK_PERM=1"
102,2.173029,10.4.246.118,10.65.0.31,TCP,54,1687  >  443 [ACK] Seq=1 Ack=1 Win=65535 Len=0
103,2.176539,10.4.246.118,10.65.0.31,TLSv1.2,253,Client Hello
104,2.19735,10.65.0.31,10.4.246.118,TCP,54,443  >  1686 [ACK] Seq=1 Ack=210 Win=3959 Len=0
105,2.199029,10.65.0.31,10.4.246.118,TLSv1.2,1304,Server Hello
106,2.199083,10.4.246.118,10.65.0.31,TCP,54,1686  >  443 [ACK] Seq=210 Ack=1251 Win=65535 Len=0
107,2.200229,10.65.0.31,10.4.246.118,TCP,1304,443  >  1686 [ACK] Seq=1251 Ack=210 Win=3959 Len=1250 [TCP segment of a reassembled PDU]
108,2.200229,10.65.0.31,10.4.246.118,TLSv1.2,929,"Certificate, Server Key Exchange, Server Hello Done"
109,2.200279,10.4.246.118,10.65.0.31,TCP,54,1686  >  443 [ACK] Seq=210 Ack=3376 Win=65535 Len=0
110,2.202696,10.4.246.118,10.65.0.31,TLSv1.2,180,"Client Key Exchange, Change Cipher Spec, Encrypted Handshake Message"
111,2.202881,10.4.246.118,10.65.0.31,TLSv1.2,757,Application Data
112,2.208203,10.65.0.31,10.4.246.118,TCP,54,443  >  1687 [ACK] Seq=1 Ack=200 Win=3949 Len=0
113,2.213785,10.65.0.31,10.4.246.118,TLSv1.2,1304,Server Hello
114,2.213848,10.4.246.118,10.65.0.31,TCP,54,1687  >  443 [ACK] Seq=200 Ack=1251 Win=65535 Len=0
115,2.213999,10.65.0.31,10.4.246.118,TCP,1304,"443  >  1687 [PSH, ACK] Seq=1251 Ack=200 Win=3949 Len=1250 [TCP segment of a reassembled PDU]"
116,2.214028,10.4.246.118,10.65.0.31,TCP,54,1687  >  443 [ACK] Seq=200 Ack=2501 Win=65535 Len=0
117,2.214686,10.65.0.31,10.4.246.118,TLSv1.2,929,"Certificate, Server Key Exchange, Server Hello Done"
118,2.214714,10.4.246.118,10.65.0.31,TCP,54,1687  >  443 [ACK] Seq=200 Ack=3376 Win=65535 Len=0
119,2.230486,10.65.0.31,10.4.246.118,TCP,54,443  >  1686 [ACK] Seq=3376 Ack=336 Win=4085 Len=0
120,2.231017,10.4.246.118,10.65.0.31,TCP,66,1688  >  443 [SYN] Seq=0 Win=65535 Len=0 MSS=1460 WS=256 SACK_PERM=1
121,2.231861,10.65.0.31,10.4.246.118,TCP,54,443  >  1686 [ACK] Seq=3376 Ack=1039 Win=4788 Len=0
122,2.232228,10.65.0.31,10.4.246.118,TLSv1.2,328,"New Session Ticket, Change Cipher Spec, Encrypted Handshake Message"
123,2.232268,10.4.246.118,10.65.0.31,TCP,54,1686  >  443 [ACK] Seq=1039 Ack=3650 Win=65535 Len=0
124,2.233041,10.65.0.31,10.4.246.118,TLSv1.2,1304,Application Data
125,2.233071,10.4.246.118,10.65.0.31,TCP,54,1686  >  443 [ACK] Seq=1039 Ack=4900 Win=65535 Len=0
126,2.233863,10.65.0.31,10.4.246.118,TCP,1304,"443  >  1686 [PSH, ACK] Seq=4900 Ack=1039 Win=4788 Len=1250 [TCP segment of a reassembled PDU]"
127,2.233881,10.4.246.118,10.65.0.31,TCP,54,1686  >  443 [ACK] Seq=1039 Ack=6150 Win=65535 Len=0
128,2.234012,10.65.0.31,10.4.246.118,TCP,1304,443  >  1686 [ACK] Seq=6150 Ack=1039 Win=4788 Len=1250 [TCP segment of a reassembled PDU]
129,2.234043,10.4.246.118,10.65.0.31,TCP,54,1686  >  443 [ACK] Seq=1039 Ack=7400 Win=65535 Len=0
130,2.234429,10.65.0.31,10.4.246.118,TCP,1304,"443  >  1686 [PSH, ACK] Seq=7400 Ack=1039 Win=4788 Len=1250 [TCP segment of a reassembled PDU]"
131,2.234453,10.4.246.118,10.65.0.31,TCP,54,1686  >  443 [ACK] Seq=1039 Ack=8650 Win=65535 Len=0
132,2.235116,10.65.0.31,10.4.246.118,TCP,1304,"443  >  1686 [PSH, ACK] Seq=8650 Ack=1039 Win=4788 Len=1250 [TCP segment of a reassembled PDU]"
133,2.235117,10.65.0.31,10.4.246.118,TCP,656,"443  >  1686 [PSH, ACK] Seq=9900 Ack=1039 Win=4788 Len=602 [TCP segment of a reassembled PDU]"
134,2.235153,10.4.246.118,10.65.0.31,TCP,54,1686  >  443 [ACK] Seq=1039 Ack=10502 Win=65535 Len=0
135,2.256184,10.4.246.118,93.184.221.240,TCP,66,1690  >  80 [SYN] Seq=0 Win=64240 Len=0 MSS=1460 WS=256 SACK_PERM=1
136,2.260487,10.65.0.31,10.4.246.118,TCP,602,"443  >  1686 [PSH, ACK] Seq=10502 Ack=1039 Win=4788 Len=548 [TCP segment of a reassembled PDU]"
137,2.260531,10.4.246.118,10.65.0.31,TCP,54,1686  >  443 [ACK] Seq=1039 Ack=11050 Win=65535 Len=0
138,2.26068,10.65.0.31,10.4.246.118,TCP,154,443  >  1686 [ACK] Seq=11050 Ack=1039 Win=4788 Len=100 [TCP segment of a reassembled PDU]
139,2.260702,10.4.246.118,10.65.0.31,TCP,54,1686  >  443 [ACK] Seq=1039 Ack=11150 Win=65535 Len=0
140,2.261284,10.65.0.31,10.4.246.118,TCP,1304,"443  >  1686 [PSH, ACK] Seq=11150 Ack=1039 Win=4788 Len=1250 [TCP segment of a reassembled PDU]"
141,2.261316,10.4.246.118,10.65.0.31,TCP,54,1686  >  443 [ACK] Seq=1039 Ack=12400 Win=65535 Len=0
142,2.262463,10.65.0.31,10.4.246.118,TCP,1304,443  >  1686 [ACK] Seq=12400 Ack=1039 Win=4788 Len=1250 [TCP segment of a reassembled PDU]
143,2.262548,10.4.246.118,10.65.0.31,TCP,54,1686  >  443 [ACK] Seq=1039 Ack=13650 Win=65535 Len=0
144,2.262866,10.65.0.31,10.4.246.118,TCP,1304,"443  >  1686 [PSH, ACK] Seq=13650 Ack=1039 Win=4788 Len=1250 [TCP segment of a reassembled PDU]"
145,2.262925,10.4.246.118,10.65.0.31,TCP,54,1686  >  443 [ACK] Seq=1039 Ack=14900 Win=65535 Len=0
146,2.263379,10.65.0.31,10.4.246.118,TCP,1304,443  >  1686 [ACK] Seq=14900 Ack=1039 Win=4788 Len=1250 [TCP segment of a reassembled PDU]
147,2.263447,10.4.246.118,10.65.0.31,TCP,54,1686  >  443 [ACK] Seq=1039 Ack=16150 Win=65535 Len=0
148,2.263758,10.65.0.31,10.4.246.118,TCP,1304,"443  >  1686 [PSH, ACK] Seq=16150 Ack=1039 Win=4788 Len=1250 [TCP segment of a reassembled PDU]"
149,2.263778,10.4.246.118,10.65.0.31,TCP,54,1686  >  443 [ACK] Seq=1039 Ack=17400 Win=65535 Len=0
150,2.264039,10.65.0.31,10.4.246.118,TCP,1304,443  >  1686 [ACK] Seq=17400 Ack=1039 Win=4788 Len=1250 [TCP segment of a reassembled PDU]
151,2.26407,10.4.246.118,10.65.0.31,TCP,54,1686  >  443 [ACK] Seq=1039 Ack=18650 Win=65535 Len=0
152,2.264527,10.65.0.31,10.4.246.118,TCP,1304,443  >  1686 [ACK] Seq=18650 Ack=1039 Win=4788 Len=1250 [TCP segment of a reassembled PDU]
153,2.264528,10.65.0.31,10.4.246.118,TLSv1.2,612,Application Data
154,2.26456,10.4.246.118,10.65.0.31,TCP,54,1686  >  443 [ACK] Seq=1039 Ack=20458 Win=65535 Len=0
155,2.264852,10.65.0.31,10.4.246.118,TCP,1304,443  >  1686 [ACK] Seq=20458 Ack=1039 Win=4788 Len=1250 [TCP segment of a reassembled PDU]
156,2.264884,10.4.246.118,10.65.0.31,TCP,54,1686  >  443 [ACK] Seq=1039 Ack=21708 Win=65535 Len=0
157,2.265449,10.65.0.31,10.4.246.118,TCP,1304,443  >  1686 [ACK] Seq=21708 Ack=1039 Win=4788 Len=1250 [TCP segment of a reassembled PDU]
158,2.265481,10.4.246.118,10.65.0.31,TCP,54,1686  >  443 [ACK] Seq=1039 Ack=22958 Win=65535 Len=0
159,2.265644,10.65.0.31,10.4.246.118,TCP,1304,"443  >  1686 [PSH, ACK] Seq=22958 Ack=1039 Win=4788 Len=1250 [TCP segment of a reassembled PDU]"
160,2.265644,10.65.0.31,10.4.246.118,TCP,62,"443  >  1688 [SYN, ACK] Seq=0 Ack=1 Win=3750 Len=0 MSS=1250 SACK_PERM=1"
161,2.265714,10.4.246.118,10.65.0.31,TCP,54,1686  >  443 [ACK] Seq=1039 Ack=24208 Win=65535 Len=0
162,2.265739,10.4.246.118,10.65.0.31,TCP,54,1688  >  443 [ACK] Seq=1 Ack=1 Win=65535 Len=0
163,2.266121,10.4.246.118,10.65.0.31,TLSv1.2,263,Client Hello
164,2.274772,10.4.246.118,51.140.188.242,TCP,66,1691  >  443 [SYN] Seq=0 Win=65535 Len=0 MSS=1460 WS=256 SACK_PERM=1
165,2.283542,93.184.221.240,10.4.246.118,TCP,66,"80  >  1690 [SYN, ACK] Seq=0 Ack=1 Win=5560 Len=0 MSS=1250 SACK_PERM=1 WS=128"
166,2.283622,10.4.246.118,93.184.221.240,TCP,54,1690  >  80 [ACK] Seq=1 Ack=1 Win=131072 Len=0
167,2.28402,10.4.246.118,93.184.221.240,HTTP,299,GET /msdownload/update/v3/static/trustedr/en/disallowedcertstl.cab?1aaf9000446a30d4 HTTP/1.1 
168,2.284174,10.4.246.118,52.16.176.29,TCP,66,1692  >  443 [SYN] Seq=0 Win=65535 Len=0 MSS=1460 WS=8 SACK_PERM=1
169,2.28882,10.65.0.31,10.4.246.118,TCP,1304,"443  >  1686 [PSH, ACK] Seq=24208 Ack=1039 Win=4788 Len=1250 [TCP segment of a reassembled PDU]"
170,2.288886,10.4.246.118,10.65.0.31,TCP,54,1686  >  443 [ACK] Seq=1039 Ack=25458 Win=65535 Len=0
171,2.289155,10.65.0.31,10.4.246.118,TCP,1304,443  >  1686 [ACK] Seq=25458 Ack=1039 Win=4788 Len=1250 [TCP segment of a reassembled PDU]
172,2.289191,10.4.246.118,10.65.0.31,TCP,54,1686  >  443 [ACK] Seq=1039 Ack=26708 Win=65535 Len=0
173,2.289835,10.65.0.31,10.4.246.118,TCP,1304,"443  >  1686 [PSH, ACK] Seq=26708 Ack=1039 Win=4788 Len=1250 [TCP segment of a reassembled PDU]"
174,2.289867,10.4.246.118,10.65.0.31,TCP,54,1686  >  443 [ACK] Seq=1039 Ack=27958 Win=65535 Len=0
175,2.291348,10.65.0.31,10.4.246.118,TCP,1304,443  >  1686 [ACK] Seq=27958 Ack=1039 Win=4788 Len=1250 [TCP segment of a reassembled PDU]
176,2.291368,10.4.246.118,10.65.0.31,TCP,54,1686  >  443 [ACK] Seq=1039 Ack=29208 Win=65535 Len=0
177,2.292128,10.65.0.31,10.4.246.118,TCP,1304,"443  >  1686 [PSH, ACK] Seq=29208 Ack=1039 Win=4788 Len=1250 [TCP segment of a reassembled PDU]"
178,2.292129,10.65.0.31,10.4.246.118,TCP,1304,443  >  1686 [ACK] Seq=30458 Ack=1039 Win=4788 Len=1250 [TCP segment of a reassembled PDU]
179,2.292169,10.4.246.118,10.65.0.31,TCP,54,1686  >  443 [ACK] Seq=1039 Ack=31708 Win=65535 Len=0
180,2.292805,10.65.0.31,10.4.246.118,TCP,1304,"443  >  1686 [PSH, ACK] Seq=31708 Ack=1039 Win=4788 Len=1250 [TCP segment of a reassembled PDU]"
181,2.292841,10.4.246.118,10.65.0.31,TCP,54,1686  >  443 [ACK] Seq=1039 Ack=32958 Win=65535 Len=0
182,2.293789,10.65.0.31,10.4.246.118,TCP,1304,443  >  1686 [ACK] Seq=32958 Ack=1039 Win=4788 Len=1250 [TCP segment of a reassembled PDU]
183,2.29379,10.65.0.31,10.4.246.118,TCP,1304,"443  >  1686 [PSH, ACK] Seq=34208 Ack=1039 Win=4788 Len=1250 [TCP segment of a reassembled PDU]"
184,2.29379,10.65.0.31,10.4.246.118,TCP,1304,443  >  1686 [ACK] Seq=35458 Ack=1039 Win=4788 Len=1250 [TCP segment of a reassembled PDU]
185,2.293817,10.4.246.118,10.65.0.31,TCP,54,1686  >  443 [ACK] Seq=1039 Ack=36708 Win=65535 Len=0
186,2.293991,10.65.0.31,10.4.246.118,TLSv1.2,993,"Application Data, Application Data, Encrypted Alert"
187,2.293992,10.65.0.31,10.4.246.118,TCP,54,"443  >  1686 [FIN, ACK] Seq=37647 Ack=1039 Win=4788 Len=0"
188,2.294024,10.4.246.118,10.65.0.31,TCP,54,1686  >  443 [ACK] Seq=1039 Ack=37648 Win=65535 Len=0
189,2.294361,10.4.246.118,10.65.0.31,TCP,54,"1686  >  443 [FIN, ACK] Seq=1039 Ack=37648 Win=65535 Len=0"
190,2.297198,10.4.246.118,239.255.255.250,SSDP,143,M-SEARCH * HTTP/1.1 
191,2.300017,10.65.0.31,10.4.246.118,TCP,54,443  >  1688 [ACK] Seq=1 Ack=210 Win=3959 Len=0
192,2.30207,10.65.0.31,10.4.246.118,TLSv1.2,1304,Server Hello
193,2.302141,10.4.246.118,10.65.0.31,TCP,54,1688  >  443 [ACK] Seq=210 Ack=1251 Win=65535 Len=0
194,2.302461,10.65.0.31,10.4.246.118,TCP,1304,443  >  1688 [ACK] Seq=1251 Ack=210 Win=3959 Len=1250 [TCP segment of a reassembled PDU]
195,2.302464,51.140.188.242,10.4.246.118,TCP,66,"443  >  1691 [SYN, ACK] Seq=0 Ack=1 Win=5560 Len=0 MSS=1250 SACK_PERM=1 WS=128"
196,2.302572,10.4.246.118,10.65.0.31,TCP,54,1688  >  443 [ACK] Seq=210 Ack=2501 Win=65535 Len=0
197,2.30262,10.4.246.118,51.140.188.242,TCP,54,1691  >  443 [ACK] Seq=1 Ack=1 Win=262144 Len=0
198,2.302888,10.4.246.118,51.140.188.242,TLSv1.2,262,Client Hello
199,2.305379,10.65.0.31,10.4.246.118,TLSv1.2,929,"Certificate, Server Key Exchange, Server Hello Done"
200,2.305425,10.4.246.118,10.65.0.31,TCP,54,1688  >  443 [ACK] Seq=210 Ack=3376 Win=65535 Len=0
201,2.307916,10.4.246.118,10.65.0.31,TLSv1.2,180,"Client Key Exchange, Change Cipher Spec, Encrypted Handshake Message"
202,2.308147,10.4.246.118,10.65.0.31,TLSv1.2,781,Application Data
203,2.311266,93.184.221.240,10.4.246.118,TCP,54,80  >  1690 [ACK] Seq=1 Ack=246 Win=6656 Len=0
204,2.312154,93.184.221.240,10.4.246.118,HTTP,946,HTTP/1.1 200 OK  (text/html)
205,2.312154,93.184.221.240,10.4.246.118,TCP,54,"80  >  1690 [FIN, ACK] Seq=893 Ack=246 Win=6656 Len=0"
206,2.312221,10.4.246.118,93.184.221.240,TCP,54,1690  >  80 [ACK] Seq=246 Ack=894 Win=130304 Len=0
207,2.312319,52.16.176.29,10.4.246.118,TCP,66,"443  >  1692 [SYN, ACK] Seq=0 Ack=1 Win=5560 Len=0 MSS=1250 SACK_PERM=1 WS=128"
208,2.312394,10.4.246.118,52.16.176.29,TCP,54,1692  >  443 [ACK] Seq=1 Ack=1 Win=262176 Len=0
209,2.312522,10.4.246.118,93.184.221.240,TCP,54,"1690  >  80 [FIN, ACK] Seq=246 Ack=894 Win=130304 Len=0"
210,2.32228,10.65.0.31,10.4.246.118,TCP,54,443  >  1686 [ACK] Seq=37648 Ack=1040 Win=4788 Len=0
211,2.329206,10.4.246.118,52.16.176.29,TLSv1,571,Client Hello
212,2.33048,51.140.188.242,10.4.246.118,TCP,54,443  >  1691 [ACK] Seq=1 Ack=209 Win=6656 Len=0
213,2.330654,51.140.188.242,10.4.246.118,TCP,54,"443  >  1691 [FIN, ACK] Seq=1 Ack=209 Win=6656 Len=0"
214,2.330698,10.4.246.118,51.140.188.242,TCP,54,1691  >  443 [ACK] Seq=209 Ack=2 Win=262144 Len=0
215,2.331967,10.4.246.118,51.140.188.242,TCP,54,"1691  >  443 [FIN, ACK] Seq=209 Ack=2 Win=262144 Len=0"
216,2.333556,10.4.246.118,93.184.220.29,TCP,66,1695  >  80 [SYN] Seq=0 Win=64240 Len=0 MSS=1460 WS=256 SACK_PERM=1
217,2.333704,10.4.246.118,51.140.188.242,TCP,66,1694  >  443 [SYN] Seq=0 Win=65535 Len=0 MSS=1460 WS=256 SACK_PERM=1
218,2.335667,10.65.0.31,10.4.246.118,TCP,54,443  >  1688 [ACK] Seq=3376 Ack=336 Win=4085 Len=0
219,2.33682,10.65.0.31,10.4.246.118,TLSv1.2,328,"New Session Ticket, Change Cipher Spec, Encrypted Handshake Message"
220,2.336866,10.4.246.118,10.65.0.31,TCP,54,1688  >  443 [ACK] Seq=1063 Ack=3650 Win=65535 Len=0
221,2.337017,10.65.0.31,10.4.246.118,TCP,54,443  >  1688 [ACK] Seq=3650 Ack=1063 Win=4812 Len=0
222,2.339659,93.184.221.240,10.4.246.118,TCP,54,80  >  1690 [ACK] Seq=894 Ack=247 Win=6656 Len=0
223,2.357469,52.16.176.29,10.4.246.118,TCP,54,443  >  1692 [ACK] Seq=1 Ack=518 Win=6656 Len=0
224,2.357887,52.16.176.29,10.4.246.118,TCP,54,"443  >  1692 [FIN, ACK] Seq=1 Ack=518 Win=6656 Len=0"
225,2.35793,10.4.246.118,52.16.176.29,TCP,54,1692  >  443 [ACK] Seq=518 Ack=2 Win=262176 Len=0
226,2.358088,10.4.246.118,52.16.176.29,TCP,54,"1692  >  443 [FIN, ACK] Seq=518 Ack=2 Win=262176 Len=0"
227,2.359416,51.140.188.242,10.4.246.118,TCP,54,443  >  1691 [ACK] Seq=2 Ack=210 Win=6656 Len=0
228,2.360952,93.184.220.29,10.4.246.118,TCP,66,"80  >  1695 [SYN, ACK] Seq=0 Ack=1 Win=5560 Len=0 MSS=1250 SACK_PERM=1 WS=128"
229,2.361048,10.4.246.118,93.184.220.29,TCP,54,1695  >  80 [ACK] Seq=1 Ack=1 Win=131072 Len=0
230,2.361168,51.140.188.242,10.4.246.118,TCP,66,"443  >  1694 [SYN, ACK] Seq=0 Ack=1 Win=5560 Len=0 MSS=1250 SACK_PERM=1 WS=128"
231,2.361219,10.4.246.118,51.140.188.242,TCP,54,1694  >  443 [ACK] Seq=1 Ack=1 Win=262144 Len=0
232,2.361411,10.4.246.118,93.184.220.29,HTTP,286,GET /MFEwTzBNMEswSTAJBgUrDgMCGgUABBTfqhLjKLEJQZPin0KCzkdAQpVYowQUsT7DaQP4v0cB1JgmGggC72NkK8MCEAaWj5ZK6CNWx04XwrU2WwA%3D HTTP/1.1 
233,2.363613,10.4.246.118,51.140.188.242,TLSv1,196,Client Hello
234,2.385455,52.16.176.29,10.4.246.118,TCP,54,443  >  1692 [ACK] Seq=2 Ack=519 Win=6656 Len=0
235,2.388706,93.184.220.29,10.4.246.118,TCP,54,80  >  1695 [ACK] Seq=1 Ack=233 Win=6656 Len=0
236,2.389632,93.184.220.29,10.4.246.118,HTTP,1006,HTTP/1.1 200 OK  (text/html)
237,2.389633,93.184.220.29,10.4.246.118,TCP,54,"80  >  1695 [FIN, ACK] Seq=953 Ack=233 Win=6656 Len=0"
238,2.389684,10.4.246.118,93.184.220.29,TCP,54,1695  >  80 [ACK] Seq=233 Ack=954 Win=130048 Len=0
239,2.390181,10.4.246.118,93.184.220.29,TCP,54,"1695  >  80 [FIN, ACK] Seq=233 Ack=954 Win=130048 Len=0"
240,2.391168,51.140.188.242,10.4.246.118,TCP,54,443  >  1694 [ACK] Seq=1 Ack=143 Win=6656 Len=0
241,2.391341,51.140.188.242,10.4.246.118,TCP,54,"443  >  1694 [FIN, ACK] Seq=1 Ack=143 Win=6656 Len=0"
242,2.391373,10.4.246.118,51.140.188.242,TCP,54,1694  >  443 [ACK] Seq=143 Ack=2 Win=262144 Len=0
243,2.391508,10.4.246.118,51.140.188.242,TCP,54,"1694  >  443 [FIN, ACK] Seq=143 Ack=2 Win=262144 Len=0"
244,2.392725,10.4.246.118,51.140.188.242,TCP,66,1696  >  443 [SYN] Seq=0 Win=65535 Len=0 MSS=1460 WS=256 SACK_PERM=1
245,2.403061,10.4.246.118,93.184.220.29,TCP,66,1698  >  80 [SYN] Seq=0 Win=64240 Len=0 MSS=1460 WS=256 SACK_PERM=1
246,2.417241,93.184.220.29,10.4.246.118,TCP,54,80  >  1695 [ACK] Seq=954 Ack=234 Win=6656 Len=0
247,2.418645,51.140.188.242,10.4.246.118,TCP,54,443  >  1694 [ACK] Seq=2 Ack=144 Win=6656 Len=0
248,2.42029,51.140.188.242,10.4.246.118,TCP,66,"443  >  1696 [SYN, ACK] Seq=0 Ack=1 Win=5560 Len=0 MSS=1250 SACK_PERM=1 WS=128"
249,2.420376,10.4.246.118,51.140.188.242,TCP,54,1696  >  443 [ACK] Seq=1 Ack=1 Win=262144 Len=0
250,2.420463,10.4.246.118,51.140.188.242,TCP,54,"1696  >  443 [FIN, ACK] Seq=1 Ack=1 Win=262144 Len=0"
251,2.430471,93.184.220.29,10.4.246.118,TCP,66,"80  >  1698 [SYN, ACK] Seq=0 Ack=1 Win=5560 Len=0 MSS=1250 SACK_PERM=1 WS=128"
252,2.430562,10.4.246.118,93.184.220.29,TCP,54,1698  >  80 [ACK] Seq=1 Ack=1 Win=131072 Len=0
253,2.430764,10.4.246.118,93.184.220.29,OCSP,359,Request
254,2.447938,51.140.188.242,10.4.246.118,TCP,54,"443  >  1696 [FIN, ACK] Seq=1 Ack=2 Win=5632 Len=0"
255,2.448002,10.4.246.118,51.140.188.242,TCP,54,1696  >  443 [ACK] Seq=2 Ack=2 Win=262144 Len=0
256,2.458281,93.184.220.29,10.4.246.118,TCP,54,80  >  1698 [ACK] Seq=1 Ack=306 Win=6656 Len=0
257,2.458667,93.184.220.29,10.4.246.118,TCP,54,"80  >  1698 [FIN, ACK] Seq=1 Ack=306 Win=6656 Len=0"
258,2.458699,10.4.246.118,93.184.220.29,TCP,54,1698  >  80 [ACK] Seq=306 Ack=2 Win=131072 Len=0
259,2.45885,10.4.246.118,93.184.220.29,TCP,54,"1698  >  80 [FIN, ACK] Seq=306 Ack=2 Win=131072 Len=0"
260,2.470764,10.4.246.118,93.184.220.29,TCP,66,1700  >  80 [SYN] Seq=0 Win=64240 Len=0 MSS=1460 WS=256 SACK_PERM=1
261,2.486205,93.184.220.29,10.4.246.118,TCP,54,80  >  1698 [ACK] Seq=2 Ack=307 Win=6656 Len=0
262,2.498234,93.184.220.29,10.4.246.118,TCP,66,"80  >  1700 [SYN, ACK] Seq=0 Ack=1 Win=5560 Len=0 MSS=1250 SACK_PERM=1 WS=128"
263,2.498463,10.4.246.118,93.184.220.29,TCP,54,1700  >  80 [ACK] Seq=1 Ack=1 Win=131072 Len=0
264,2.498831,10.4.246.118,93.184.220.29,HTTP,205,GET /DigiCertHighAssuranceEVRootCA.crl HTTP/1.1 
265,2.52609,93.184.220.29,10.4.246.118,TCP,54,80  >  1700 [ACK] Seq=1 Ack=152 Win=6656 Len=0
266,2.526907,93.184.220.29,10.4.246.118,HTTP,844,HTTP/1.1 200 OK  (text/html)
267,2.526907,93.184.220.29,10.4.246.118,TCP,54,"80  >  1700 [FIN, ACK] Seq=791 Ack=152 Win=6656 Len=0"
268,2.526939,10.4.246.118,93.184.220.29,TCP,54,1700  >  80 [ACK] Seq=152 Ack=792 Win=130304 Len=0
269,2.527566,10.4.246.118,93.184.220.29,TCP,54,"1700  >  80 [FIN, ACK] Seq=152 Ack=792 Win=130304 Len=0"
270,2.553062,10.4.246.118,93.184.220.29,TCP,66,1702  >  80 [SYN] Seq=0 Win=64240 Len=0 MSS=1460 WS=256 SACK_PERM=1
271,2.555192,93.184.220.29,10.4.246.118,TCP,54,80  >  1700 [ACK] Seq=792 Ack=153 Win=6656 Len=0
272,2.58072,93.184.220.29,10.4.246.118,TCP,66,"80  >  1702 [SYN, ACK] Seq=0 Ack=1 Win=5560 Len=0 MSS=1250 SACK_PERM=1 WS=128"
273,2.580801,10.4.246.118,93.184.220.29,TCP,54,1702  >  80 [ACK] Seq=1 Ack=1 Win=131072 Len=0
274,2.581033,10.4.246.118,93.184.220.29,HTTP,290,GET /MFEwTzBNMEswSTAJBgUrDgMCGgUABBQnt%2BO7KdI35ubyUVwz39VP7XeuiQQU5wH8DBYYyn2yjOyHJ6NvYYE7hDkCEAetZC8PDLpYLbzDET%2BIuQE%3D HTTP/1.1 
275,2.608564,93.184.220.29,10.4.246.118,TCP,54,80  >  1702 [ACK] Seq=1 Ack=237 Win=6656 Len=0
276,2.609836,93.184.220.29,10.4.246.118,HTTP,1014,HTTP/1.1 200 OK  (text/html)
277,2.609836,93.184.220.29,10.4.246.118,TCP,54,"80  >  1702 [FIN, ACK] Seq=961 Ack=237 Win=6656 Len=0"
278,2.60987,10.4.246.118,93.184.220.29,TCP,54,1702  >  80 [ACK] Seq=237 Ack=962 Win=130048 Len=0
279,2.648107,10.65.0.31,10.4.246.118,TLSv1.2,828,Application Data
280,2.64816,10.4.246.118,10.65.0.31,TCP,54,1688  >  443 [ACK] Seq=1063 Ack=4424 Win=65535 Len=0
281,2.648314,10.65.0.31,10.4.246.118,TLSv1.2,85,Encrypted Alert
282,2.648338,10.4.246.118,10.65.0.31,TCP,54,1688  >  443 [ACK] Seq=1063 Ack=4455 Win=65535 Len=0
283,2.648469,10.65.0.31,10.4.246.118,TCP,54,"443  >  1688 [FIN, ACK] Seq=4455 Ack=1063 Win=4812 Len=0"
284,2.648489,10.4.246.118,10.65.0.31,TCP,54,1688  >  443 [ACK] Seq=1063 Ack=4456 Win=65535 Len=0
285,2.649909,10.4.246.118,10.65.0.31,TCP,54,"1688  >  443 [FIN, ACK] Seq=1063 Ack=4456 Win=65535 Len=0"
286,2.64999,10.4.246.118,10.65.0.31,TCP,54,"1688  >  443 [RST, ACK] Seq=1064 Ack=4456 Win=0 Len=0"
287,2.656805,10.4.246.118,10.65.0.31,TCP,66,1703  >  443 [SYN] Seq=0 Win=65535 Len=0 MSS=1460 WS=256 SACK_PERM=1
288,2.676949,10.4.246.118,51.140.188.242,TCP,66,1704  >  443 [SYN] Seq=0 Win=65535 Len=0 MSS=1460 WS=256 SACK_PERM=1
289,2.677723,10.65.0.31,10.4.246.118,TCP,54,443  >  1688 [ACK] Seq=4456 Ack=1064 Win=4812 Len=0
290,2.686734,10.65.0.31,10.4.246.118,TCP,62,"443  >  1703 [SYN, ACK] Seq=0 Ack=1 Win=3750 Len=0 MSS=1250 SACK_PERM=1"
291,2.686815,10.4.246.118,10.65.0.31,TCP,54,1703  >  443 [ACK] Seq=1 Ack=1 Win=65535 Len=0
292,2.687193,10.4.246.118,10.65.0.31,TLSv1.2,263,Client Hello
293,2.704484,51.140.188.242,10.4.246.118,TCP,66,"443  >  1704 [SYN, ACK] Seq=0 Ack=1 Win=5560 Len=0 MSS=1250 SACK_PERM=1 WS=128"
294,2.70457,10.4.246.118,51.140.188.242,TCP,54,1704  >  443 [ACK] Seq=1 Ack=1 Win=262144 Len=0
295,2.704928,10.4.246.118,51.140.188.242,TLSv1.2,262,Client Hello
296,2.721121,10.65.0.31,10.4.246.118,TCP,54,443  >  1703 [ACK] Seq=1 Ack=210 Win=3959 Len=0
297,2.725652,10.65.0.31,10.4.246.118,TLSv1.2,1304,Server Hello
298,2.725687,10.4.246.118,10.65.0.31,TCP,54,1703  >  443 [ACK] Seq=210 Ack=1251 Win=65535 Len=0
299,2.7266,10.65.0.31,10.4.246.118,TCP,1304,443  >  1703 [ACK] Seq=1251 Ack=210 Win=3959 Len=1250 [TCP segment of a reassembled PDU]
300,2.726601,10.65.0.31,10.4.246.118,TLSv1.2,929,"Certificate, Server Key Exchange, Server Hello Done"
301,2.726642,10.4.246.118,10.65.0.31,TCP,54,1703  >  443 [ACK] Seq=210 Ack=3376 Win=65535 Len=0
302,2.728066,10.4.246.118,10.65.0.31,TLSv1.2,180,"Client Key Exchange, Change Cipher Spec, Encrypted Handshake Message"
303,2.728253,10.4.246.118,10.65.0.31,TLSv1.2,836,Application Data
304,2.732299,51.140.188.242,10.4.246.118,TCP,54,443  >  1704 [ACK] Seq=1 Ack=209 Win=6656 Len=0
305,2.732373,51.140.188.242,10.4.246.118,TCP,54,"443  >  1704 [FIN, ACK] Seq=1 Ack=209 Win=6656 Len=0"
306,2.732396,10.4.246.118,51.140.188.242,TCP,54,1704  >  443 [ACK] Seq=209 Ack=2 Win=262144 Len=0
307,2.732552,10.4.246.118,51.140.188.242,TCP,54,"1704  >  443 [FIN, ACK] Seq=209 Ack=2 Win=262144 Len=0"
308,2.733099,10.4.246.118,51.140.188.242,TCP,66,1705  >  443 [SYN] Seq=0 Win=65535 Len=0 MSS=1460 WS=256 SACK_PERM=1
309,2.755994,10.65.0.31,10.4.246.118,TCP,54,443  >  1703 [ACK] Seq=3376 Ack=336 Win=4085 Len=0
310,2.756999,10.65.0.31,10.4.246.118,TCP,54,443  >  1703 [ACK] Seq=3376 Ack=1118 Win=4867 Len=0
311,2.757629,10.65.0.31,10.4.246.118,TLSv1.2,328,"New Session Ticket, Change Cipher Spec, Encrypted Handshake Message"
312,2.757659,10.4.246.118,10.65.0.31,TCP,54,1703  >  443 [ACK] Seq=1118 Ack=3650 Win=65535 Len=0
313,2.759877,51.140.188.242,10.4.246.118,TCP,54,443  >  1704 [ACK] Seq=2 Ack=210 Win=6656 Len=0
314,2.760175,51.140.188.242,10.4.246.118,TCP,66,"443  >  1705 [SYN, ACK] Seq=0 Ack=1 Win=5560 Len=0 MSS=1250 SACK_PERM=1 WS=128"
315,2.760245,10.4.246.118,51.140.188.242,TCP,54,1705  >  443 [ACK] Seq=1 Ack=1 Win=262144 Len=0
316,2.760491,10.4.246.118,51.140.188.242,TLSv1,196,Client Hello
317,2.787996,51.140.188.242,10.4.246.118,TCP,54,443  >  1705 [ACK] Seq=1 Ack=143 Win=6656 Len=0
318,2.788182,51.140.188.242,10.4.246.118,TCP,54,"443  >  1705 [FIN, ACK] Seq=1 Ack=143 Win=6656 Len=0"
319,2.78823,10.4.246.118,51.140.188.242,TCP,54,1705  >  443 [ACK] Seq=143 Ack=2 Win=262144 Len=0
320,2.788275,10.4.246.118,51.140.188.242,TCP,54,"1705  >  443 [FIN, ACK] Seq=143 Ack=2 Win=262144 Len=0"
321,2.788769,10.4.246.118,51.140.188.242,TCP,66,1706  >  443 [SYN] Seq=0 Win=65535 Len=0 MSS=1460 WS=256 SACK_PERM=1
322,2.816199,51.140.188.242,10.4.246.118,TCP,54,443  >  1705 [ACK] Seq=2 Ack=144 Win=6656 Len=0
323,2.816506,51.140.188.242,10.4.246.118,TCP,66,"443  >  1706 [SYN, ACK] Seq=0 Ack=1 Win=5560 Len=0 MSS=1250 SACK_PERM=1 WS=128"
324,2.816581,10.4.246.118,51.140.188.242,TCP,54,1706  >  443 [ACK] Seq=1 Ack=1 Win=262144 Len=0
325,2.816662,10.4.246.118,51.140.188.242,TCP,54,"1706  >  443 [FIN, ACK] Seq=1 Ack=1 Win=262144 Len=0"
326,2.818895,10.4.246.118,10.65.2.46,DNS,77,Standard query 0x7242 A wpad.o2wifi.co.uk
327,2.821577,10.65.0.31,10.4.246.118,TLSv1.2,1304,"Application Data, Application Data"
328,2.821634,10.4.246.118,10.65.0.31,TCP,54,1703  >  443 [ACK] Seq=1118 Ack=4900 Win=65535 Len=0
329,2.822006,10.65.0.31,10.4.246.118,TCP,1304,443  >  1703 [ACK] Seq=4900 Ack=1118 Win=4867 Len=1250 [TCP segment of a reassembled PDU]
330,2.822036,10.4.246.118,10.65.0.31,TCP,54,1703  >  443 [ACK] Seq=1118 Ack=6150 Win=65535 Len=0
331,2.822635,10.65.0.31,10.4.246.118,TCP,1304,443  >  1703 [ACK] Seq=6150 Ack=1118 Win=4867 Len=1250 [TCP segment of a reassembled PDU]
332,2.822677,10.4.246.118,10.65.0.31,TCP,54,1703  >  443 [ACK] Seq=1118 Ack=7400 Win=65535 Len=0
333,2.82387,10.65.0.31,10.4.246.118,TCP,1304,"443  >  1703 [PSH, ACK] Seq=7400 Ack=1118 Win=4867 Len=1250 [TCP segment of a reassembled PDU]"
334,2.82387,10.65.0.31,10.4.246.118,TCP,1304,"443  >  1703 [PSH, ACK] Seq=8650 Ack=1118 Win=4867 Len=1250 [TCP segment of a reassembled PDU]"
335,2.823871,10.65.0.31,10.4.246.118,TCP,1204,"443  >  1703 [PSH, ACK] Seq=9900 Ack=1118 Win=4867 Len=1150 [TCP segment of a reassembled PDU]"
336,2.823927,10.4.246.118,10.65.0.31,TCP,54,1703  >  443 [ACK] Seq=1118 Ack=11050 Win=65535 Len=0
337,2.844233,51.140.188.242,10.4.246.118,TCP,54,"443  >  1706 [FIN, ACK] Seq=1 Ack=2 Win=5632 Len=0"
338,2.844308,10.4.246.118,51.140.188.242,TCP,54,1706  >  443 [ACK] Seq=2 Ack=2 Win=262144 Len=0
339,2.848349,10.65.2.46,10.4.246.118,DNS,161,Standard query response 0x7242 No such name A wpad.o2wifi.co.uk SOA ib-4.dns.mer.o2wifi.co.uk
340,2.849443,10.65.0.31,10.4.246.118,TCP,154,443  >  1703 [ACK] Seq=11050 Ack=1118 Win=4867 Len=100 [TCP segment of a reassembled PDU]
341,2.849478,10.4.246.118,10.65.0.31,TCP,54,1703  >  443 [ACK] Seq=1118 Ack=11150 Win=65535 Len=0
342,2.850943,10.65.0.31,10.4.246.118,TCP,1304,443  >  1703 [ACK] Seq=11150 Ack=1118 Win=4867 Len=1250 [TCP segment of a reassembled PDU]
343,2.850986,10.4.246.118,10.65.0.31,TCP,54,1703  >  443 [ACK] Seq=1118 Ack=12400 Win=65535 Len=0
344,2.851165,10.65.0.31,10.4.246.118,TCP,1304,443  >  1703 [ACK] Seq=12400 Ack=1118 Win=4867 Len=1250 [TCP segment of a reassembled PDU]
345,2.851198,10.4.246.118,10.65.0.31,TCP,54,1703  >  443 [ACK] Seq=1118 Ack=13650 Win=65535 Len=0
346,2.852126,10.65.0.31,10.4.246.118,TCP,1304,"443  >  1703 [PSH, ACK] Seq=13650 Ack=1118 Win=4867 Len=1250 [TCP segment of a reassembled PDU]"
347,2.852129,10.65.0.31,10.4.246.118,TCP,1304,443  >  1703 [ACK] Seq=14900 Ack=1118 Win=4867 Len=1250 [TCP segment of a reassembled PDU]
348,2.852174,10.4.246.118,10.65.0.31,TCP,54,1703  >  443 [ACK] Seq=1118 Ack=16150 Win=65535 Len=0
349,2.852333,10.65.0.31,10.4.246.118,TLSv1.2,407,"Application Data, Application Data, Application Data, Encrypted Alert"
350,2.852334,10.65.0.31,10.4.246.118,TCP,54,"443  >  1703 [FIN, ACK] Seq=16503 Ack=1118 Win=4867 Len=0"
351,2.852375,10.4.246.118,10.65.0.31,TCP,54,1703  >  443 [ACK] Seq=1118 Ack=16504 Win=65535 Len=0
352,2.85258,10.4.246.118,10.65.0.31,TCP,54,"1703  >  443 [FIN, ACK] Seq=1118 Ack=16504 Win=65535 Len=0"
353,2.866636,10.4.246.118,10.65.0.31,TCP,66,1707  >  443 [SYN] Seq=0 Win=65535 Len=0 MSS=1460 WS=256 SACK_PERM=1
354,2.866657,10.4.246.118,10.65.0.31,TCP,66,1708  >  443 [SYN] Seq=0 Win=65535 Len=0 MSS=1460 WS=256 SACK_PERM=1
355,2.866747,10.4.246.118,10.65.0.31,TCP,66,1709  >  443 [SYN] Seq=0 Win=65535 Len=0 MSS=1460 WS=256 SACK_PERM=1
356,2.866772,10.4.246.118,10.65.0.31,TCP,66,1710  >  443 [SYN] Seq=0 Win=65535 Len=0 MSS=1460 WS=256 SACK_PERM=1
357,2.870179,10.4.246.118,10.65.0.31,TCP,66,1711  >  443 [SYN] Seq=0 Win=65535 Len=0 MSS=1460 WS=256 SACK_PERM=1
358,2.881053,10.65.0.31,10.4.246.118,TCP,54,443  >  1703 [ACK] Seq=16504 Ack=1119 Win=4867 Len=0
359,2.897815,10.65.0.31,10.4.246.118,TCP,62,"443  >  1707 [SYN, ACK] Seq=0 Ack=1 Win=3750 Len=0 MSS=1250 SACK_PERM=1"
360,2.897886,10.4.246.118,10.65.0.31,TCP,54,1707  >  443 [ACK] Seq=1 Ack=1 Win=65535 Len=0
361,2.898003,10.65.0.31,10.4.246.118,TCP,62,"443  >  1708 [SYN, ACK] Seq=0 Ack=1 Win=3750 Len=0 MSS=1250 SACK_PERM=1"
362,2.898049,10.4.246.118,10.65.0.31,TCP,54,1708  >  443 [ACK] Seq=1 Ack=1 Win=65535 Len=0
363,2.898358,10.4.246.118,10.65.0.31,TLSv1.2,263,Client Hello
364,2.898533,10.65.0.31,10.4.246.118,TCP,62,"443  >  1709 [SYN, ACK] Seq=0 Ack=1 Win=3750 Len=0 MSS=1250 SACK_PERM=1"
365,2.898585,10.4.246.118,10.65.0.31,TCP,54,1709  >  443 [ACK] Seq=1 Ack=1 Win=65535 Len=0
366,2.898751,10.4.246.118,10.65.0.31,TLSv1.2,263,Client Hello
367,2.899203,10.4.246.118,10.65.0.31,TLSv1.2,263,Client Hello
368,2.899359,10.65.0.31,10.4.246.118,TCP,62,"443  >  1710 [SYN, ACK] Seq=0 Ack=1 Win=3750 Len=0 MSS=1250 SACK_PERM=1"
369,2.899411,10.4.246.118,10.65.0.31,TCP,54,1710  >  443 [ACK] Seq=1 Ack=1 Win=65535 Len=0
370,2.899923,10.4.246.118,10.65.0.31,TLSv1.2,263,Client Hello
371,2.905098,10.65.0.31,10.4.246.118,TCP,62,"443  >  1711 [SYN, ACK] Seq=0 Ack=1 Win=3750 Len=0 MSS=1250 SACK_PERM=1"
372,2.905158,10.4.246.118,10.65.0.31,TCP,54,1711  >  443 [ACK] Seq=1 Ack=1 Win=65535 Len=0
373,2.905581,10.4.246.118,10.65.0.31,TLSv1.2,263,Client Hello
374,2.929305,10.65.0.31,10.4.246.118,TCP,54,443  >  1707 [ACK] Seq=1 Ack=210 Win=3959 Len=0
375,2.929306,10.65.0.31,10.4.246.118,TCP,54,443  >  1708 [ACK] Seq=1 Ack=210 Win=3959 Len=0
376,2.929306,10.65.0.31,10.4.246.118,TCP,54,443  >  1709 [ACK] Seq=1 Ack=210 Win=3959 Len=0
377,2.931517,10.65.0.31,10.4.246.118,TCP,54,443  >  1710 [ACK] Seq=1 Ack=210 Win=3959 Len=0
378,2.932646,10.65.0.31,10.4.246.118,TLSv1.2,1304,Server Hello
379,2.932673,10.4.246.118,10.65.0.31,TCP,54,1707  >  443 [ACK] Seq=210 Ack=1251 Win=65535 Len=0
380,2.932914,10.65.0.31,10.4.246.118,TCP,1304,443  >  1707 [ACK] Seq=1251 Ack=210 Win=3959 Len=1250 [TCP segment of a reassembled PDU]
381,2.932934,10.4.246.118,10.65.0.31,TCP,54,1707  >  443 [ACK] Seq=210 Ack=2501 Win=65535 Len=0
382,2.933639,10.65.0.31,10.4.246.118,TLSv1.2,929,"Certificate, Server Key Exchange, Server Hello Done"
